{
  "artifact_kind": "validated_run_terminal_result",
  "boundary_confirmations": {
    "educational_threshold_reinterpreted_as_operational": false,
    "publisher_promotion_invoked": false,
    "registry_state_written": false
  },
  "durable_references": {
    "inference_bundle": {
      "path": "pipeline/inference-bundles/dry-bean/inference-bundle.json",
      "sha256": "502e726d3c40bf2927a9b61a1881b60b7b568859e59a0ba6ea9ac4da2b46d773"
    },
    "manifest": {
      "path": "publisher/runs/validate-20260818T230644Z/manifest.json",
      "sha256": "aa4f371c0c9fc594b10c4fed8a34b4309e21b7c2debb9670947d9ec0381a573d"
    },
    "materialization_result": null,
    "operational_readiness_source": null,
    "publisher_validation_result": {
      "path": "publisher/runs/validate-20260818T230644Z/validation-result.json",
      "sha256": "52b988f216be84838d979f36477131d1d3784af60ccd10ad3bfbd4b6acb272a4"
    },
    "release_candidate": {
      "path": "releases/candidates/dry-bean/release-20260818-001/release-candidate.json",
      "sha256": "1687429e2940faea350f904eb2ce2a517b8dcff87cde8c4a856fa76d56c1c87d"
    }
  },
  "manifest_outcome": {
    "manifest_generated": true,
    "manifest_path": "publisher/runs/validate-20260818T230644Z/manifest.json"
  },
  "model_source_mode": "atlas_internal_training",
  "operational_readiness": {
    "operational_prediction_available": false,
    "operational_threshold": {
      "status": "not_applicable",
      "value": null
    },
    "operational_validity": "not_applicable"
  },
  "promotion_eligibility": true,
  "reasons": [],
  "run_identity": {
    "created_at": "2026-08-18T23:06:44+00:00",
    "dataset_slug": "dry-bean",
    "run_id": "train-20260818T230643Z"
  },
  "schema_version": "validated-run-terminal-result.v1",
  "status": "completed",
  "structural_validation": {
    "checked": true,
    "validation_outcome": "accepted"
  }
}
