{
  "artifact_kind": "validated_run_terminal_result",
  "boundary_confirmations": {
    "educational_threshold_reinterpreted_as_operational": false,
    "publisher_promotion_invoked": false,
    "registry_state_written": false
  },
  "durable_references": {
    "inference_bundle": {
      "path": "pipeline/inference-bundles/telco-customer-churn/inference-bundle.json",
      "sha256": "6ac6077738aa23c68d55beea9d25778b231ca3ef577ad9831c8b08cbbdbdefa1"
    },
    "manifest": {
      "path": "publisher/runs/validate-20260829T220956Z/manifest.json",
      "sha256": "2e68e938c1fcb46295fe34590e7eb6760099728f6b7633c560fbc0274e7a6b44"
    },
    "materialization_result": null,
    "operational_readiness_source": null,
    "publisher_validation_result": {
      "path": "publisher/runs/validate-20260829T220956Z/validation-result.json",
      "sha256": "af827c855aae032636ff7b8518d7b7f7988db4585ec9720c90bcb87cea4f6435"
    },
    "release_candidate": {
      "path": "releases/candidates/telco-customer-churn/release-20260829-004/release-candidate.json",
      "sha256": "fd1719d6c8b83b650ea1cc678531e25c27e6a6e3cbec4e4506405c0307629e9b"
    }
  },
  "manifest_outcome": {
    "manifest_generated": true,
    "manifest_path": "publisher/runs/validate-20260829T220956Z/manifest.json"
  },
  "model_source_mode": "atlas_internal_training",
  "operational_readiness": {
    "operational_prediction_available": false,
    "operational_threshold": {
      "status": "not_applicable",
      "value": null
    },
    "operational_validity": "not_applicable"
  },
  "promotion_eligibility": true,
  "reasons": [],
  "run_identity": {
    "created_at": "2026-08-29T22:09:56+00:00",
    "dataset_slug": "telco-customer-churn",
    "run_id": "train-20260829T220946Z"
  },
  "schema_version": "validated-run-terminal-result.v1",
  "status": "completed",
  "structural_validation": {
    "checked": true,
    "validation_outcome": "accepted"
  }
}
