{
  "artifact_kind": "validated_run_terminal_result",
  "boundary_confirmations": {
    "educational_threshold_reinterpreted_as_operational": false,
    "publisher_promotion_invoked": false,
    "registry_state_written": false
  },
  "durable_references": {
    "inference_bundle": {
      "path": "pipeline/external-fitted-model-runs/telco-customer-churn/telco-customer-churn-external-materialization-20260811T214423Z/inference-bundle.json",
      "sha256": "34f7bac5b3ee72126b6d72c96f613ba415d92fdbd06c3302080586760cf959f6"
    },
    "manifest": {
      "path": "publisher/runs/validate-20260811T214424Z/manifest.json",
      "sha256": "f8ecde05a75ae45e18ef9e574174a580af5ff64336f843623d85da720902d1d2"
    },
    "materialization_result": {
      "path": "pipeline/external-fitted-model-runs/telco-customer-churn/telco-customer-churn-external-materialization-20260811T214423Z/materialization-result.json",
      "sha256": "32ad40b03046b3e7f884f0dde95bf970f780f182d5b703856b4b6f50c00b05a2"
    },
    "operational_readiness_source": {
      "path": "pipeline/external-fitted-model-runs/telco-customer-churn/telco-customer-churn-external-materialization-20260811T214423Z/materialization-result.json",
      "sha256": "32ad40b03046b3e7f884f0dde95bf970f780f182d5b703856b4b6f50c00b05a2"
    },
    "publisher_validation_result": {
      "path": "publisher/runs/validate-20260811T214424Z/validation-result.json",
      "sha256": "cabcddb35c8b8c7a1e8c8d07e02314789b0cc062691ef29d3e8238d415e216e0"
    },
    "release_candidate": {
      "path": "releases/candidates/telco-customer-churn/release-20260811-001/release-candidate.json",
      "sha256": "9567c615f37c6e531eceb6b93ad506636e472abe56103a783b5c67c3326837a8"
    }
  },
  "manifest_outcome": {
    "manifest_generated": true,
    "manifest_path": "publisher/runs/validate-20260811T214424Z/manifest.json"
  },
  "model_source_mode": "validated_external_fitted_model",
  "operational_readiness": {
    "operational_prediction_available": false,
    "operational_threshold": {
      "status": "unresolved",
      "value": null
    },
    "operational_validity": "unconfirmed"
  },
  "promotion_eligibility": false,
  "reasons": [],
  "run_identity": {
    "created_at": "2026-08-11T21:44:24+00:00",
    "dataset_slug": "telco-customer-churn",
    "run_id": "telco-customer-churn-external-materialization-20260811T214423Z"
  },
  "schema_version": "validated-run-terminal-result.v1",
  "status": "completed",
  "structural_validation": {
    "checked": true,
    "validation_outcome": "accepted"
  }
}
