{
  "artifact_kind": "validated_run_terminal_result",
  "boundary_confirmations": {
    "educational_threshold_reinterpreted_as_operational": false,
    "publisher_promotion_invoked": false,
    "registry_state_written": false
  },
  "durable_references": {
    "inference_bundle": {
      "path": "pipeline/inference-bundles/telco-customer-churn/inference-bundle.json",
      "sha256": "06c72493b5588b25e38a1aaec4b6cc87a5f0bf00134b962edb32388d5489f041"
    },
    "manifest": {
      "path": "publisher/runs/validate-20260829T221040Z/manifest.json",
      "sha256": "90211ad9050247605b13a9b8dae0bfa68ddaadff3a32d428352c7cbee3b6aec4"
    },
    "materialization_result": null,
    "operational_readiness_source": null,
    "publisher_validation_result": {
      "path": "publisher/runs/validate-20260829T221040Z/validation-result.json",
      "sha256": "699fd3fd582e1efd0beba4c4f71ce1ca1ae2fba68c972290958d48a7dd65cc82"
    },
    "release_candidate": {
      "path": "releases/candidates/telco-customer-churn/release-20260829-006/release-candidate.json",
      "sha256": "30f20d04c5bdcb6633c7045d4341b19902406af35eabb238bc59354701efd352"
    }
  },
  "manifest_outcome": {
    "manifest_generated": true,
    "manifest_path": "publisher/runs/validate-20260829T221040Z/manifest.json"
  },
  "model_source_mode": "atlas_internal_training",
  "operational_readiness": {
    "operational_prediction_available": false,
    "operational_threshold": {
      "status": "not_applicable",
      "value": null
    },
    "operational_validity": "not_applicable"
  },
  "promotion_eligibility": true,
  "reasons": [],
  "run_identity": {
    "created_at": "2026-08-29T22:10:40+00:00",
    "dataset_slug": "telco-customer-churn",
    "run_id": "train-20260829T221030Z"
  },
  "schema_version": "validated-run-terminal-result.v1",
  "status": "completed",
  "structural_validation": {
    "checked": true,
    "validation_outcome": "accepted"
  }
}
